{
  "schemaVersion": 1,
  "name": "maintain-product",
  "job": "Cut live or regression harm with a root-cause fix on the owning layer.",
  "boundaries": {
    "inScope": [
      "Framing symptom, severity, audience, and health signal",
      "Reproducing and bisecting to root cause",
      "Fixing cause on the owning layer with regression locks",
      "Re-running the failing path"
    ],
    "outOfScope": [
      "Feature expansion or visual redesign without a harm link",
      "Papering over shared floors in the wrong layer",
      "Unrelated refactors or improve-everything polish"
    ]
  },
  "inputs": [
    "Live or regression symptom with severity and audience",
    "Logs, tests, live smoke, and reports",
    "Health signal that must improve this cycle"
  ],
  "outputs": [
    "Root-cause fix with regression test or smoke where automatable",
    "Failing path re-run",
    "Residual risk and structural follow-ups"
  ],
  "required": {
    "tools": [
      "reproduction and live-verification tooling"
    ],
    "data": [
      "evidence: logs, tests, live smoke, reports"
    ],
    "permissions": [
      "delivery access on the owning layer"
    ]
  },
  "failureSemantics": "The cycle is not done until the framed harm is fixed or mitigated on the failing path, reproduction is closed or a residual owner is named, and no obvious new regression appears on the touched path.",
  "outcome": {
    "observable": "The failing path re-runs clean or the residual is owned, and the touched path shows no obvious new regression.",
    "oracleOwner": "user-system"
  }
}
