{
  "schemaVersion": 1,
  "name": "deliver-app-events",
  "job": "Send email, webhooks, realtime, or push through Platform Events.",
  "boundaries": {
    "inScope": [
      "Binding a delivery connector",
      "Submitting a typed message with request identity",
      "Recording the provider receipt"
    ],
    "outOfScope": [
      "Campaign copy and audience segmentation",
      "Time-based activation and queue consumers"
    ]
  },
  "inputs": [
    "Channel kind and payload",
    "Runtime credential and connector identity"
  ],
  "outputs": [
    "Bound connector",
    "Delivery Operation terminal with receipt"
  ],
  "required": {
    "tools": ["Platform Events SDK or runtime API"],
    "data": [],
    "permissions": ["runtime send"]
  },
  "failureSemantics": "A local log line is not delivery; the Operation must reach a terminal with a receipt.",
  "outcome": {
    "observable": "A typed message was submitted on the Platform Events contract and the Delivery Operation reached a terminal with a receipt.",
    "oracleOwner": "user-system"
  }
}
