{
  "schemaVersion": 1,
  "name": "persist-app-data",
  "job": "Persist app data on Platform Data bindings: database, KV, objects, or search.",
  "boundaries": {
    "inScope": [
      "Declaring and consuming Platform Data bindings",
      "Write-then-read on relational, KV, object, or search stores",
      "Applying schema through the Platform migrations Job"
    ],
    "outOfScope": [
      "Product-domain validation rules beyond storage",
      "Identity sessions"
    ]
  },
  "inputs": [
    "Named data job and record shape",
    "Project environment and binding"
  ],
  "outputs": [
    "Declared binding consumed by the app",
    "Write-then-read proof"
  ],
  "required": {
    "tools": ["sylphx CLI or Platform SDK"],
    "data": [],
    "permissions": ["project resource bind"]
  },
  "failureSemantics": "A health check is not data proof; the named resource must accept a write and return it.",
  "outcome": {
    "observable": "The app writes and reads the named record through a Platform Data binding.",
    "oracleOwner": "user-system"
  }
}
